'861557153993','header','Product Description'
'829664835033','normal','Bên cạnh đó, máy còn được trang bị sẵn ổ cứng SSD 512GB PCIe NVMe, cho tốc độ đọc/ghi dữ liệu nhanh gấp nhiều lần so với HDD truyền thống. Đây là yếu tố giúp laptop khởi động, mở ứng dụng và sao chép dữ liệu cực nhanh, nâng cao hiệu suất làm việc cho bạn.'
'829664835033','bold','Đầy đủ các phương thức kết nối mà bạn cần'
'829664835033','normal','Dù sở hữu thiết kế mỏng nhẹ, Acer Aspire Lite 15 vẫn được trang bị đầy đủ các cổng kết nối cần thiết gồm 3 cổng USB-A, 1 cổng USB-C 3.2 Gen 2, 1 cổng xuất hình HDMI 1.4, jack cắm tai nghe 3.5mm và khe đọc thẻ MicroSD.'
'829664835033','normal','Ngoài ra, laptop Acer Aspire còn sở hữu kết nối Wi-Fi tiện dụng và Bluetooth 5.1, cho phép duy trì tín hiệu tương tác ổn định, hiệu quả để bạn thoải mái làm việc và giải trí.'
'829664835033','bold','Sở hữu bàn phím và touchpad tiện dụng'
'829664835033','normal','Laptop Acer Aspire Lite 15 AL15-41P-R3U5 được trang bị bàn phím có kích thước tiêu chuẩn với hành trình phím hợp lý, mang lại trải nghiệm gõ phím thoải mái. Ngoài ra, touchpad rộng rãi với độ nhạy cao giúp thao tác mượt mà, không cần sử dụng tới chuột ngoài.'
'829664835033','bold','Thời lượng pin bền bỉ, sạc nhanh tiện lợi'
'829664835033','normal','Với viên pin dung lượng lớn, laptop Acer Aspire Lite 15 có thể vận hành bền bỉ liên tục trong nhiều giờ mà không cần kết nối với nguồn điện. Công nghệ sạc nhanh giúp nạp lại năng lượng nhanh chóng, đảm bảo bạn luôn có thể tiếp tục công việc, tránh bị gián đoạn trải nghiệm ở những thời điểm quan trọng cần thiết.'
