'"I5-13420H/16GB/512GB PCIE/14.0 WUXGA/WIN11/BẠC"','"/t/e/text_ng_n_7__4_47.png"','true','[]','"42WHrs, 3S1P, 3-cell Li-ion"','null','"Bluetooth 5.3"','"Liên hệ CSKH"','null','"Intel Core i5-13420H 2.1 GHz (12MB Cache, up to 4.6 GHz, 8 lõi, 12 luồng)"','"31.71 x 22.20 x 1.99 ~ 1.99 cm (Dài x Rộng x Dày)"','null','"1920 x 1200 pixels (WUXGA)"','"14 inches"','"Độ sáng 300nits<br>Độ phủ màu 45% NTSC<br>Màn hình chống chói"','"0.1"','null','"2019-01-01 00:00:00"','"0.0000"','[]','"0.7"','"0.3"','"512GB"','102244','"/g/r/group_808.png"','null','"Bộ nguồn, máy, sách hdsd"','true','"<ul><li>Laptop c&oacute; thiết kế gọn nhẹ, m&agrave;u bạc tinh tế, ph&ugrave; hợp cho những người thường xuy&ecirc;n di chuyển hoặc l&agrave;m việc linh hoạt.</li><li>Trang bị vi xử l&yacute; Intel Core i5-13420H, kết hợp RAM 16GB, mang lại hiệu suất mạnh mẽ v&agrave; khả năng đa nhiệm mượt m&agrave;.</li><li>Ổ cứng SSD 512GB PCIe đảm bảo tốc độ khởi động nhanh, truy xuất dữ liệu nhanh ch&oacute;ng v&agrave; kh&ocirc;ng gian lưu trữ rộng r&atilde;i cho người d&ugrave;ng.</li><li>M&agrave;n h&igrave;nh 14.0 inch WUXGA với tỷ lệ 16:10 cho h&igrave;nh ảnh sắc n&eacute;t, độ chi tiết cao, ph&ugrave; hợp cho c&ocirc;ng việc văn ph&ograve;ng lẫn giải tr&iacute;.</li></ul>"','null','"720p HD với màn trập camera"','"SonicMaster<br> Loa tích hợp<br> Micrô mảng tích hợp"','"Intel Core i5"','null','"Đồ hoạ 2D, edit hình ảnh"','"Chiclet Keyboard"','"DDR4"','"Xã hội - kinh tế"','"16GB"','"WUXGA"','"Khoảng 14 inch"','"8GB DDR4 on board + 8GB DDR4 SO-DIMM"','"Wi-Fi 6, Bảo mật vân tay"','"Tấm nền IPS"','"60 Hz"','"Card Onboard"','"Chính hãng"','"no_selection"','"no_selection"','"ASUS"','"/g/r/group_808.png"','"Laptop ASUS Vivobook 14 X1405VA-LY623W | Giá rẻ, trả góp 0%"','"-"','null','"4"','"2"','"Học tập - Văn phòng"','"512GB M.2 NVMe PCIe 4.0 SSD"','"container2"','"Windows 11 Home"','"1x USB 2.0 Type-A (tốc độ dữ liệu lên đến 480Mbps)<br> 1x USB 3.2 Gen 1 Type-C hỗ trợ cấp nguồn (tốc độ dữ liệu lên đến 5Gbps)<br> 2x USB 3.2 Gen 1 Type-A (tốc độ dữ liệu lên đến 5Gbps)<br> 1x HDMI 1.4<br> 1x Giắc cắm âm thanh kết hợp 3.5mm<br> 1x DC-in"','"Mới"','"Normal"','102244','"Nguyên hộp, đầy đủ phụ kiện từ nhà sản xuất<br> Bảo hành pin và bộ sạc 12 tháng"','"1.60 kg"','"I5-13420H <br>16GB - 512GB <br>14.0 - WUXGA"','"2020-12-31 00:00:00"','"2020-01-01 00:00:00"','"GỌI THẢ GA, DATA KHỦNG"','"/g/r/group_808.png"','null','"SMS"','null','true','null','true','null','"500000.0000"','"Giá chính thức"','"laptop-asus-vivobook-14-x1405va-ly623w"','"laptop-asus-vivobook-14-x1405va-ly623w.html"','true','"Intel UHD Graphics"','"Bảo hành 24 tháng tại trung tâm bảo hành Chính hãng. 1 đổi 1 trong 30 ngày nếu có lỗi phần cứng từ nhà sản xuất. "','null','"Wi-Fi 6E(802.11ax) (Dual band) 1*1"','"Cảm biến vân tay tích hợp với Touchpad<br> McAfee<br> BIOS Booting User Password Protection<br> Trusted Platform Module (Firmware TPM)"','null','"Vỏ nhựa"','null','null','null','null','null','null','null','null','null','null','null','null','null','null','null','null','null','null','null','null','null','null','null','"Nhựa"','"Nhựa"','null','null','"Nhựa"','null','null','null','null','null','null','null','null','null','null','null','null','null','null','null','null','null','null','null','null'
'"I7-13620H/16GB/1TB PCIE/VGA 8GB RTX4060/15.6 FHD 144HZ/WIN11/ĐEN/BALO"','"/t/e/text_ng_n_11__2_50.png"','true','[]','"3 cell, 53.5Whr"','"1247.0000"','"Bluetooth\\tv5.2"','"Liên hệ CSKH"','"1247.0000"','"Intel Core i7-13620H (3.6GHz~4.9GHz, 10 lõi / 16 luồng)"','"359 x 259 x 24.9 mm"','"1247.0000"','"1920 x 1080 pixels (FullHD)"','"15.6 inches"','"Tần số quét 144Hz <br> Độ phủ màu 45% NTSC"','null','"1247.0000"','"2019-01-01 00:00:00"','"1247.0000"','[]','null','null','"1TB"','61491','"/g/r/group_509_30_.png"','"Laptop MSI Katana 15 B13VFK-676VN"','null','true','"<ul><li>CPU Intel Core i7-13620H xử l&yacute; gọn g&agrave;ng từng t&aacute;c vụ nặng nhẹ</li><li>GPU RTX 4060 c&acirc;n mọi tựa game AAA với hiệu năng xử l&yacute; đồ họa đỉnh cao</li><li>16GB RAM xử l&yacute; đa t&aacute;c vụ thoải m&aacute;i v&agrave; mượt m&agrave;</li><li>Kh&ocirc;ng gian lưu trũ khổng lồ l&ecirc;n đến 1TB SSD</li><li>M&agrave;n h&igrave;nh 15.6 inch Full HD c&ugrave;ng tần số qu&eacute;t 144 Hz đảm bảo bắt kịp từng h&agrave;nh động của đối thủ</li><li>B&agrave;n ph&iacute;m thiết kế 4-Zone RGB l&agrave;m nổi bật kh&ocirc;ng gian giải tr&iacute; cho mọi game thủ</li></ul>"','"Không"','"HD type (30fps@720p)"','"Nahimic Audio & HiRes Audio"','"Intel Core i7"','"RTX 4060"','"Đồ hoạ 3D, chỉnh sửa video"','"4-Zone RGB Gaming Keyboard"','"DDR5 5200MHz"','"Lập trình , Đồ hoạ"','"16GB"','"Full HD"','"Trên 15 inch"','"2x SO-DIMM socket (Nâng cấp tối đa 64GB SDRAM)"','"Wi-Fi 6"','"Tấm nền IPS"','"144Hz"','"NVIDIA GeForce Series"','"Chính hãng"','"no_selection"','"no_selection"','"MSI"','"/g/r/group_509_30_.png"','"Laptop MSI Katana 15 B13VFK-676VN | Giá rẻ, trả góp 0%"','"-"','"1247.0000"','"4"','"2"','"Gaming"','"1TB NVMe PCIe Gen 4 SSD"','"container2"','"Windows 11 Home"','"1x Type-C (USB3.2 Gen1 / DP) <br> 2x Type-A USB3.2 Gen1<br> 1x Type-A USB2.0<br> 1x HDMI 2.1 (8K @ 60Hz / 4K @ 120Hz)<br> 1x RJ45"','"Mới"','"Normal"','61491','"Nguyên hộp, đầy đủ phụ kiện từ nhà sản xuất<br> Bảo hành pin và bộ sạc 12 tháng"','"2.25 kg"','"I7-13620H<br>16GB - 1TB<br>RTX4060"','"2020-12-31 00:00:00"','"2020-01-01 00:00:00"','"GỌI THẢ GA, DATA KHỦNG"','"/g/r/group_509_30_.png"','"Laptop MSI Katana 15 B13VFK-676VN"','"SMS"','"1247.0000"','true','"laptop-msi-katana-15-b13vfk-676vn"','true','"Laptop MSI Katana 15 B13VFK-676VN"','"1247.0000"','"Giá chính thức"','"laptop-msi-katana-15-b13vfk-676vn"','"laptop-msi-katana-15-b13vfk-676vn.html"','true','"NVIDIA GeForce RTX 4060, GDDR6 8GB"','"Bảo hành 24 tháng tại trung tâm bảo hành Chính hãng. 1 đổi 1 trong 30 ngày nếu có lỗi phần cứng từ nhà sản xuất. "','"1247.0000"','"802.11 ax Wi-Fi 6 "','null','true','null','null','null','null','null','null','null','null','"1247.0000"','null','null','null','null','null','null','null','null','null','null','null','null','null','null','null','null','null','"Copilot"','null','null','null','null','null','null','null','null','null','null','null','null','null','null','null','null','null','null','null','null','null','null'
'"I7-13700HX/16GB/512GB PCIE/VGA 6GB RTX3050/16.1 FHD 165HZ/WIN/ĐEN"','"/t/e/text_ng_n_5__8_106.png"','true','[]','"4-cell, 70 Wh Li-ion polymer <br>Bộ đổi nguồn AC thông minh 200 W<br>Hỗ trợ sạc pin nhanh: khoảng 50% trong 30 phút"','null','"Bluetooth 5.3"','"Liên hệ CSKH"','null','"Intel Core i7-13700HX (up to 5.0 GHz with Intel Turbo Boost Technology, 30 MB L3 cache,16 lõi, 24 luồng)"','"36.9 x 25.94 x 2.29 cm (mặt trước) <br> 36.9 x 25.94 x 2.39 cm (mặt sau)"','null','"1920 x 1080 pixels (FullHD)"','"16.1 inches"','"Độ phủ màu 100% sRGB<br>Độ sáng 300 nits<br>Thời gian phản hồi 7 ms<br>Ánh sáng xanh thấp"','"0.1"','null','"2019-01-01 00:00:00"','"0.0000"','[]','"0.7"','"0.3"','"512GB"','102610','"/t/e/text_d_i_6_57.png"','null','"Bộ nguồn, máy, sách hdsd"','true','"<ul><li>Trang bị bộ vi xử l&yacute; Intel Core i7-13700HX mạnh mẽ, c&ugrave;ng RAM 16GB, đ&aacute;p ứng tốt c&aacute;c nhu cầu từ c&ocirc;ng việc văn ph&ograve;ng đến chơi game v&agrave; xử l&yacute; đồ họa.</li><li>Card đồ họa NVIDIA GeForce RTX 3050 6GB, laptop mang lại khả năng hiển thị h&igrave;nh ảnh chất lượng cao, hỗ trợ chơi game mượt m&agrave; v&agrave; xử l&yacute; c&aacute;c t&aacute;c vụ đồ họa nặng.</li><li>M&agrave;n h&igrave;nh 16.1 inch Full HD với tần số qu&eacute;t 165Hz c&ugrave;ng độ phủ m&agrave;u 100% sRGB gi&uacute;p h&igrave;nh ảnh hiển thị mượt m&agrave;, giảm hiện tượng x&eacute; h&igrave;nh, rất ph&ugrave; hợp cho game thủ v&agrave; người d&ugrave;ng chuy&ecirc;n nghiệp.</li><li>Ổ cứng SSD 512GB PCIe cung cấp tốc độ đọc/ghi dữ liệu nhanh ch&oacute;ng, đảm bảo hiệu suất cao cho c&aacute;c ứng dụng v&agrave; kh&ocirc;ng gian lưu trữ thoải m&aacute;i.</li></ul>"','null','"Camera HP True Vision 1080p FHD có chức năng giảm nhiễu theo thời gian và micrô kỹ thuật số mảng kép tích hợp"','"Công nghệ âm thanh của B&O<br> Loa kép<br> HP Audio Boost"','"Intel Core i7"','"RTX 3050"','"Đồ hoạ 3D, chỉnh sửa video"','"Bàn phím kích thước đầy đủ, có đèn nền RGB 1 vùng, màu xám đá mặt trăng với bàn phím số"','"DDR5-4800 MT/s"','"Lập trình , Đồ hoạ"','"16GB"','"Full HD"','"Trên 15 inch"','"2 khe (2 x 8 GB)"','"Viền màn hình siêu mỏng, Wi-Fi 6"','"Tấm nền IPS"','"165 Hz"','"NVIDIA GeForce Series"','"Chính hãng"','"no_selection"','"no_selection"','"HP"','"/t/e/text_d_i_6_57.png"','"Laptop HP Victus 16-R0376TX AY8Z2PA | Giá rẻ, trả góp 0%"','"-"','null','"4"','"2"','"Đồ họa - Kỹ thuật, Gaming"','"512 GB PCIe Gen4 NVMeTM M.2 SSD"','"container2"','"Windows 11 Home Single Language"','"1x USB Type-A (HP Sleep and Charge)<br> 1x USB Type-C (sạc nhanh, DisplayPort 1.4, HP Sleep and Charge) <br> 2x USB Type-A<br> 1x cổng HDMI 2.1<br> 1x RJ-45<br> 1x bộ chuyển đổi điện xoay chiều thông minh<br> 1x cổng kết hợp tai nghe/micrô"','"Mới"','"Normal"','102610','"Nguyên hộp, đầy đủ phụ kiện từ nhà sản xuất<br> Bảo hành pin và bộ sạc 12 tháng"','"2.31 kg"','"I7-13700HX <br>16GB - 512GB <br> RTX3050 - 165HZ"','"2020-12-31 00:00:00"','"2020-01-01 00:00:00"','"GỌI THẢ GA, DATA KHỦNG"','"/t/e/text_d_i_6_57.png"','null','"SMS"','null','true','null','true','null','"500000.0000"','"Giá chính thức"','"laptop-hp-victus-16-r0376tx-ay8z2pa"','"laptop-hp-victus-16-r0376tx-ay8z2pa.html"','true','"NVIDIA GeForce RTX 3050 Laptop GPU (6 GB GDDR6 dedicated)"','"Bảo hành 12 tháng tại trung tâm bảo hành Chính hãng. 1 đổi 1 trong 30 ngày nếu có lỗi phần cứng từ nhà sản xuất. "','null','"Intel Wi-Fi 6E AX211 (2x2)"','"Màn trập camera<br> Hỗ trợ Trusted Platform Module (Phần mềm điều khiển TPM)"','null','null','null','null','null','null','null','null','null','null','null','null','null','null','null','null','null','null','null','null','null','null','null','null','null','null','null','null','null','null','null','null','null','null','null','null','null','null','null','null','null','null','null','null','null','null','null','null','null','null'
'"R7-7435HS/16GB/512GB PCIE/VGA 4GB RTX2050/15.6 FHD 144HZ/WIN11/ĐEN"','"/t/e/text_ng_n_14__6_64.png"','true','[]','"48 Wh, 150 W"','"704.0000"','"Bluetooth 5.3"','"Liên hệ CSKH"','"704.0000"','"AMD Ryzen 7 7435HS 3.1 - 4.5 GHz"','"35.9 x 25.6 x 2.28 ~ 2.45 cm"','"704.0000"','"1920 x 1080 pixels (FullHD)"','"15.6 inches"','"Độ sáng 250 nits<br>Độ phủ màu 45% NTSC<br>Độ tương phản 1000:01:00"','"0.1"','"704.0000"','"2019-01-01 00:00:00"','"704.0000"','[]','"0.7"','"0.3"','"512GB"','93243','"/t/e/text_d_i_4__2_3.png"','null','"Bộ nguồn, máy, sách hdsd"','true','"<ul><li>Trang bị bộ vi xử l&yacute; AMD Ryzen 7 7435HS, mang lại hiệu năng mạnh mẽ cho cả c&ocirc;ng việc v&agrave; giải tr&iacute;.</li><li>M&aacute;y c&oacute; 16GB RAM, đảm bảo khả năng đa nhiệm tốt v&agrave; xử l&yacute; mượt m&agrave; c&aacute;c ứng dụng nặng.</li><li>Ổ cứng SSD PCIe 512GB cung cấp kh&ocirc;ng gian lưu trữ đủ lớn v&agrave; tốc độ truy xuất dữ liệu nhanh ch&oacute;ng.</li><li>Card đồ họa RTX 2050 mang lại khả năng xử l&yacute; đồ họa tốt, ph&ugrave; hợp cho việc chơi game ở mức c&agrave;i đặt trung b&igrave;nh đến cao.</li><li>M&agrave;n h&igrave;nh 15.6 inch Full HD với tần số qu&eacute;t 144Hz cho trải nghiệm h&igrave;nh ảnh sắc n&eacute;t v&agrave; mượt m&agrave;.</li></ul>"','"Không"','"720P HD camera"','"Hệ thống 2 loa"','"AMD Ryzen 7"','"RTX 2050"','"Đồ hoạ 3D, chỉnh sửa video"','"LED RGB 1 Zone"','"DDR5-5600"','"Lập trình , Đồ hoạ"','"16GB"','"Full HD"','"Trên 15 inch"','"2 khe (1x16GB + 1 khe rời, nâng cấp tối đa 32GB)"','"Wi-Fi 6"','"Tấm nền IPS"','"144 Hz"','"NVIDIA GeForce Series"','"Chính hãng"','"no_selection"','"no_selection"','"ASUS"','"/t/e/text_d_i_4__2_3.png"','"Laptop ASUS TUF Gaming A15 FA506NFR-HN006W | Giá rẻ, trả góp 0%"','"-"','"704.0000"','"4"','"2"','"Đồ họa - Kỹ thuật, Gaming"','"512GB SSD M2 PCIe (Nâng cấp tối đa 1TB)"','"container2"','"Windows 11"','"1x RJ45 Gigabit Ethernet<br> 1x USB 3.2 Gen 2 Type-C<br> 3x USB 3.2 Gen 1 Type-A"','"Mới"','"Normal"','93243','"Nguyên hộp, đầy đủ phụ kiện từ nhà sản xuất<br> Bảo hành pin và bộ sạc 12 tháng"','"2.3 kg"','"R7-7435HS<br>16GB - 512GB<br> RTX2050"','"2020-12-31 00:00:00"','"2020-01-01 00:00:00"','"GỌI THẢ GA, DATA KHỦNG"','"/t/e/text_d_i_4__2_3.png"','null','"SMS"','"704.0000"','true','"laptop-asus-tuf-gaming-a15-fa506nfr-hn006w"','true','null','"704.0000"','"Giá chính thức"','"laptop-asus-tuf-gaming-a15-fa506nfr-hn006w"','"laptop-asus-tuf-gaming-a15-fa506nfr-hn006w.html"','true','"NVIDIA Geforce RTX 2050, 104 TOPS"','"Bảo hành 24 tháng tại trung tâm bảo hành Chính hãng. 1 đổi 1 trong 30 ngày nếu có lỗi phần cứng từ nhà sản xuất. "','"704.0000"','"Wifi 6"','null','null','"Vỏ nhựa"','null','null','null','null','null','null','null','null','null','null','null','null','null','null','null','null','null','null','null','null','null','null','null','null','null','"Copilot"','null','null','null','null','null','null','null','null','null','null','null','null','null','null','null','null','null','null','null','null','null','null'
'"I5-12450H/16GB/512GB PCIE/VGA 4GB RTX2050/15.6 FHD 144HZ/WIN11/XÁM/BALO"','"/t/e/text_ng_n_31__3_18_2.png"','true','[]','"3 cell, 52.4Whr"','null','"Bluetooth 5.3"','"Liên hệ CSKH"','null','"Alder Lake i5-12450H"','"359 x 254 x 21.7 mm(Dài x Rộng x Dày)"','null','"1920 x 1080 pixels (FullHD)"','"15.6 inches"','"Độ phủ màu 45%NTSC"','null','null','"2019-01-01 00:00:00"','"1352.0000"','[]','null','null','"512GB"','99884','"/t/e/text_d_i_6_38.png"','null','"Bộ nguồn, máy, balo, sách hdsd"','true','"<ul><li>Vi xử l&yacute; Intel Core i5-12450H, RAM 16GB v&agrave; ổ cứng SSD 512GB PCIe mang đến hiệu suất mượt m&agrave; cho c&aacute;c t&aacute;c vụ h&agrave;ng ng&agrave;y, chơi game v&agrave; chỉnh sửa video cơ bản.</li><li>Card đồ họa NVIDIA GeForce RTX 2050 gi&uacute;p bạn chơi game ở độ ph&acirc;n giải Full HD với mức thiết lập đồ họa trung b&igrave;nh đến cao.</li><li>M&agrave;n h&igrave;nh 15.6 inch độ ph&acirc;n giải Full HD (1920 x 1080) cho h&igrave;nh ảnh r&otilde; n&eacute;t, sống động, mang đến trải nghiệm thị gi&aacute;c tuyệt vời.</li><li>Hệ thống tản nhiệt ti&ecirc;n tiến gi&uacute;p duy tr&igrave; nhiệt độ ổn định, đảm bảo hiệu suất hoạt động tối ưu trong thời gian d&agrave;i.</li></ul>"','null','"HD 720P"','null','"Intel Core i5"','"RTX 2050"','"Đồ hoạ 3D, chỉnh sửa video"','"Bàn phím chơi game có đèn nền màu xanh"','"DDR4 3200MHz"','"Lập trình , Đồ hoạ"','"16GB"','"Full HD"','"Trên 15 inch"','"2 khe (2x 8GB, hỗ trợ nâng cấp tối đa 64GB)"','"Wi-Fi 6"','"Tấm nền IPS"','"144 Hz"','"NVIDIA GeForce Series"','"Chính hãng"','"no_selection"','"no_selection"','"MSI"','"/t/e/text_d_i_6_38.png"','"Laptop MSI Gaming Thin 15 B12UCX-1419VN | Giá rẻ, trả góp 0%"','"-"','"1352.0000"','"4"','"2"','"Đồ họa - Kỹ thuật, Gaming"','"512GB NVMe PCIe SSD Gen4x4 w/o DRAM"','"container2"','"Windows 11 Home SEA"','"1x Type-C (USB3.2 Gen1 / DP)<br> 3x Type-A USB3.2 Gen1<br> 1x HDMI (4K @ 30Hz)<br> 1x RJ45"','"Mới"','"Normal"','99884','"Nguyên hộp, đầy đủ phụ kiện từ nhà sản xuất<br> Bảo hành pin và bộ sạc 12 tháng"','"1.86 kg"','"I5-12450H <br>16GB - 512GB<br>RTX2050"','"2020-12-31 00:00:00"','"2020-01-01 00:00:00"','"GỌI THẢ GA, DATA KHỦNG"','"/t/e/text_d_i_6_38.png"','null','"SMS"','null','true','null','true','null','"1352.0000"','"Giá chính thức"','"laptop-msi-gaming-thin-15-b12ucx-1419vn-16gb"','"laptop-msi-gaming-thin-15-b12ucx-1419vn-16gb.html"','true','"Nvidia Geforce RTX 2050, GDDR6 4GB"','"Bảo hành 24 tháng tại trung tâm bảo hành Chính hãng. 1 đổi 1 trong 30 ngày nếu có lỗi phần cứng từ nhà sản xuất. "','"1352.0000"','"Intel Wi-Fi 6E AX211"','null','null','null','null','null','null','null','null','null','null','null','null','null','null','null','null','null','null','null','null','null','null','null','null','null','null','null','null','null','null','null','null','null','null','null','null','null','null','null','null','null','null','null','null','null','null','null','null','null','null','null'
'null','"/t/e/text_ng_n_2__9_14_1_1.png"','true','[]','"Thời gian xem video trực tuyến lên đến 18 giờ<br>Thời gian duyệt web trên mạng không dây lên đến 15 giờ<br>Pin Li-Po 53.8 watt‑giờ tích hợp"','null','"Bluetooth 5.3"','"Liên hệ CSKH"','null','"CPU 10 lõi với 4 lõi hiệu năng và 6 lõi tiết kiệm điện "','"Cao: 1.13 cm x Rộng: 30.41 cm x Dài: 21.5 cm"','null','"2560 x 1664 pixels"','"13.6 inches"','"Màn hình Liquid Retina <br>Có đèn nền LED<br>Mật độ 224 pixel mỗi inch<br>Độ sáng 500 nit<br>Hỗ trợ một tỷ màu<br>Dải màu rộng (P3)<br>Công nghệ True Tone"','null','null','"2019-01-01 00:00:00"','"0.0000"','[]','null','null','"512GB"','101844','"/m/a/macbook_2__21.png"','null','"MacBook Air<br> Bộ Tiếp Hợp Nguồn USB-C<br> Cáp USB-C sang MagSafe 3 (2 m)"','true','"<ul><li>MacBook Air 13 M4 2025 sở hữu thiết kế si&ecirc;u mỏng nhẹ với m&agrave;u sắc sang trọng, độ d&agrave;y chỉ 1.13 cm v&agrave; trọng lượng 1.24 kg.</li><li>M&aacute;y được trang bị chip M4 thế hệ mới nhất của Apple với 10 CPU v&agrave; 10 GPU, mang lại hiệu năng xử l&yacute; mạnh mẽ v&agrave; khả năng đồ họa ấn tượng.</li><li>RAM 24GB v&agrave; ổ cứng SSD 512GB gi&uacute;p đa nhiệm mượt m&agrave;, khởi động nhanh ch&oacute;ng v&agrave; lưu trữ đủ d&ugrave;ng cho c&ocirc;ng việc h&agrave;ng ng&agrave;y.</li><li>M&agrave;n h&igrave;nh Liquid&nbsp;Retina 13.6 inch với độ ph&acirc;n giải&nbsp;2560x1664 pixels cho h&igrave;nh ảnh sắc n&eacute;t, m&agrave;u sắc ch&acirc;n thực v&agrave; độ s&aacute;ng cao l&ecirc;n đến 500 nits.</li></ul>"','null','"Camera 12MP Center Stage có hỗ trợ chế độ Desk View<br> Quay video HD 1080p<br> Bộ xử lý tín hiệu hình ảnh tiên tiến với video điện toán"','"Hệ thống âm thanh bốn loa<br> Hỗ trợ Âm Thanh Không Gian khi phát nhạc hoặc video với Dolby Atmos trên loa tích hợp<br> Âm Thanh Không Gian với khả năng theo dõi chuyển động đầu chủ động khi sử dụng AirPods, AirPods Pro, và AirPods Max"','"Apple M4"','null','"Đồ hoạ 3D, chỉnh sửa video, Đồ hoạ 2D, edit hình ảnh"','"Bàn phím Magic Keyboard có đèn nền <br>Bàn di chuột Force Touch để điều khiển con trỏ chính xác và cảm ứng lực; hỗ trợ Bấm Mạnh, bộ tăng tốc, vẽ cảm ứng lực, và các thao tác Multi‑Touch"','null','"Lập trình , Xã hội - kinh tế, Đồ hoạ"','"24GB"','"2K (Quad HD)"','"Khoảng 13 inch"','null','"Wi-Fi 6, Bảo mật vân tay"','"Tấm nền IPS"','null','"Card Onboard"','"Chính hãng"','"no_selection"','"no_selection"','"Apple"','"/m/a/macbook_2__21.png"','"MacBook Air M4 13 inch 2025 10CPU 10GPU 24GB 512GB | Giá rẻ, trả góp 0%"','"-"','null','"4"','"2"','"Học tập - Văn phòng, Đồ họa - Kỹ thuật, Cao cấp - Sang trọng, Mỏng nhẹ, Laptop sáng tạo nội dung"','"512GB "','"container2"','"macOS"','"Cổng sạc MagSafe 3<br> Jack cắm tai nghe 3.5 mm<br> Hai cổng Thunderbolt 4 (USB-C) hỗ trợ: Sạc / DisplayPort / Thunderbolt 4 (lên đến 40Gb/s) / USB 4 (lên đến 40Gb/s)"','"Mới"','"Normal"','101844','"Máy mới 100%, đầy đủ phụ kiện từ nhà sản xuất. Sản phẩm có mã SA/A (được Apple Việt Nam phân phối chính thức)."','"1.24 kg"','"10CPU - 10GPU <br>24GB - 512GB"','"2025-05-31 00:00:00"','"2025-05-04 00:00:00"','"GỌI THẢ GA, DATA KHỦNG"','"/m/a/macbook_2__21.png"','null','"SMS"','null','true','"macbook-air-m4"','true','null','"500000.0000"','"Giá chính thức"','"apple-macbook-air-13-m4-10cpu-10gpu-24gb-512gb-2025"','"apple-macbook-air-13-m4-10cpu-10gpu-24gb-512gb-2025.html"','true','"GPU 10 lõi <br>Neural Engine 16 lõi <br>Công nghệ dò tia tốc độ cao bằng phần cứng<br>Băng thông bộ nhớ 120GB/s"','"1 ĐỔI 1 trong 30 ngày nếu có lỗi phần cứng nhà sản xuất. Bảo hành 12 tháng tại trung tâm bảo hành chính hãng Apple: CareS.vn"','null','"Wi-Fi 6E (802.11ax)"','"Touch ID"','null','"Vỏ kim loại"','null','null','null','null','null','null','null','null','"<p><span style=\\"color: #ff0000;\\"><strong><a href=\\"https://cellphones.com.vn/len-doi-macbook-air-m4-tang-airpod-4\\" target=\\"_blank\\"><span style=\\"color: #ff0000;\\">05/05 - 31/05: TẶNG NGAY AIRPODS 4 KHI THU CŨ L&Ecirc;N ĐỜI</span></a></strong></span></p>"','null','null','null','null','null','"Không"','null','null','null','null','null','null','null','null','"Nhôm"','"Nhôm"','"Apple Intelligence"','null','null','null','null','null','null','null','null','null','null','null','null','null','null','null','null','null','null','null','null','null','null'
