'"I5-12500H/16GB/512GB PCEI/14.0 2.8K OLED/WIN11/BẠC"','"/t/e/text_ng_n_4__6_10.png"','true','[]','"50WHrs, 3S1P, 3-cell Li-ion"','"2363.0000"','"Bluetooth 5.3"','"Liên hệ CSKH"','"2363.0000"','"Intel Core i5-12500H 2.5 GHz (18M Cache, up to 4.5 GHz, 4P+8E lõi)"','"31.71 x 22.20 x 1.99 ~ 1.99 cm (W x H x D)"','"2363.0000"','"2880 x 1800 pixels"','"14 inches"','"Tỷ lệ 16:10 <br> Thời gian phản hồi 0.2 ms <br> Độ sáng tối đa 600nits HDR <br> Độ phủ màu 100% DCI-P3<br>HDR True Black 600<br>1.07 tỷ màu<br>Giảm ánh sáng xanh<br>SGS Eye Care Display<br>Gamut mapping<br>Pantone"','"0.1"','"2363.0000"','"2019-01-01 00:00:00"','"2363.0000"','[]','"0.7"','"0.3"','"512GB"','83458','"/t/e/text_ng_n_1__5_13.png"','"Laptop "','"Cáp, sạc, sách hdsd"','true','"<ul><li>Sự lựa chọn ho&agrave;n hảo cho người d&ugrave;ng cần một chiếc laptop mạnh mẽ, m&agrave;n h&igrave;nh đẹp v&agrave; thiết kế sang trọng.</li><li>Trải nghiệm hiệu năng vượt trội với bộ vi xử l&yacute; Intel Core i5-12500H, RAM 16GB v&agrave; ổ cứng SSD 512GB PCIe, xử l&yacute; mượt m&agrave; mọi t&aacute;c vụ từ văn ph&ograve;ng đến giải tr&iacute;.</li><li>M&agrave;n h&igrave;nh OLED 14 inch 2.8K cho h&igrave;nh ảnh sắc n&eacute;t, m&agrave;u sắc sống động, độ tương phản cao, mang đến trải nghiệm xem phim, chơi game tuyệt vời.</li><li>Thiết kế mỏng nhẹ, m&agrave;u bạc sang trọng, thuận tiện mang theo b&ecirc;n m&igrave;nh mọi l&uacute;c mọi nơi.</li><li>Laptop được c&agrave;i đặt sẵn hệ điều h&agrave;nh Windows 11 bản quyền, cho trải nghiệm sử dụng mượt m&agrave; v&agrave; an to&agrave;n ngay từ lần khởi động đầu ti&ecirc;n.</li></ul>"','"Không"','"720p HD với màn trập camera"','"Hệ thống âm thanh SonicMaster"','"Intel Core i5"','null','"Đồ hoạ 2D, edit hình ảnh"','"Chiclet"','"DDR4"','"Xã hội - kinh tế, Đồ hoạ"','"16GB"','"2.8K"','"Khoảng 14 inch"','"8GB DDR4 on board + 8GB DDR4 SO-DIMM"','"Wi-Fi 6, Bảo mật vân tay, Màn hình Oled"','"Tấm nền Oled"','"90 Hz"','"Card Onboard"','"Chính hãng"','"no_selection"','"no_selection"','"ASUS"','"/t/e/text_ng_n_1__5_13.png"','"Laptop ASUS Vivobook 14 OLED A1405ZA-KM264W | Giá rẻ, trả góp 0%"','"-"','"2363.0000"','"4"','"2"','"Học tập - Văn phòng"','"512GB M.2 NVMe PCIe 3.0 SSD"','"container2"','"Windows 11 Home"','"1x USB 2.0 Type-A <br> 1x USB 3.2 Gen 1 Type-C <br> 2x USB 3.2 Gen 1 Type-A <br> 1x HDMI 1.4 <br> 1x Jack cắm tai nghe <br> 1x DC-in"','"Mới"','"Normal"','83458','"Nguyên hộp, đầy đủ phụ kiện từ nhà sản xuất<br> Bảo hành pin và bộ sạc 12 tháng"','"1.6 kg"','"I5-12500H <br>16GB - 512GB<br>2.8K OLED"','"2020-12-31 00:00:00"','"2020-01-01 00:00:00"','"GỌI THẢ GA, DATA KHỦNG"','"/t/e/text_ng_n_1__5_13.png"','"Laptop "','"SMS"','"2363.0000"','true','"laptop-asus-vivobook-14-oled-a1405za-km264w"','true','"Laptop "','"2363.0000"','"Giá chính thức"','"laptop-asus-vivobook-14-oled-a1405za-km264w"','"laptop-asus-vivobook-14-oled-a1405za-km264w.html"','true','"Intel Iris Xe Graphics"','"Bảo hành 24 tháng tại trung tâm bảo hành Chính hãng. 1 đổi 1 trong 30 ngày nếu có lỗi phần cứng từ nhà sản xuất. "','"2363.0000"','"Wi-Fi 6(802.11ax) (Dual band) 2*2"','"Cảm biến vân tay tích hợp Touchpad <br> Tích hợp bảo mật mật khẩu BIOS Administrator và mật khẩu người dùng <br> Mô-đun nền tảng đáng tin cậy (Firmware TPM)"','null','"Vỏ nhựa"','null','null','null','null','null','null','null','null','null','null','null','null','null','null','"Không"','null','null','null','null','null','null','null','null','"Nhựa"','"Nhựa"','null','null','"Nhựa"','"ASUS"','null','null','null','null','null','null','null','null','null','null','null','null','null','null','null','null','null','null','null'
'"I5-1335U/16GB/512GB PCIE/14.0 FHD/WIN11/BẠC"','"/t/e/text_ng_n_26__1_2.png"','true','[]','"3-cell, 41 Wh Li-ion"','"159.0000"','"Bluetooth 5.3"','"Liên hệ CSKH"','"159.0000"','"Intel Core i5 - 1335U (4.60 GHz, 10 lõi / 12 luồng, 12MB)"','"32.4 x 22.5 x 1.79 cm (Dài x Rộng x Cao)"','"159.0000"','"1920 x 1080 pixels (FullHD)"','"14 inches"','"Màn hình chống chói <br> Độ sáng 250 nits <br> Độ phủ màu 45% NTSC"','"0.1"','"159.0000"','"2019-01-01 00:00:00"','"159.0000"','[]','"0.7"','"0.3"','"512GB"','70408','"/t/e/text_ng_n_31__1_2.png"','"Laptop HP 14-EP0112TU 8C5L1PA"','"Máy, sách hướng dẫn sử dụng, sạc"','true','"<ul><li>Sở hữu thiết kế thanh lịch v&agrave; sang trọng với gam m&agrave;u tinh tế</li><li>M&agrave;n h&igrave;nh 14 inch Full HD, mang đến h&igrave;nh ảnh sắc n&eacute;t v&agrave; m&agrave;u sắc sống động</li><li>Bộ xử l&yacute; Intel Core i5-1335U cho khả năng xử l&yacute; t&aacute;c vụ đa nhiệm v&agrave; c&aacute;c ứng dụng đ&ograve;i hỏi hiệu suất cao một c&aacute;ch mượt m&agrave;</li><li>RAM 16 GB đảm bảo khả năng xử l&yacute; mọi dữ liệu nhanh ch&oacute;ng v&agrave; hiệu quả</li><li>Ổ cứng 512 GB SSD cung cấp kh&ocirc;ng gian lưu trữ lớn, gi&uacute;p bạn lưu trữ nhiều t&agrave;i liệu v&agrave; dữ liệu quan trọng</li></ul>"','"Không"','"HP True Vision 720p HD"','"2 loa"','"Intel Core i5"','null','null','null','"DDR4 3200MHz"','"Xã hội - kinh tế"','"16GB"','"Full HD"','"Khoảng 14 inch"','"2 khe (8GB + 8GB)"','"Wi-Fi 6"','null','null','"Card Onboard"','"Chính hãng"','"no_selection"','"no_selection"','"HP"','"/t/e/text_ng_n_31__1_2.png"','"Laptop HP 14-EP0112TU 8C5L1PA | Giá rẻ, trả góp 0%"','"-"','"159.0000"','"4"','"2"','"Học tập - Văn phòng, Mỏng nhẹ"','"512 GB PCIe NVMe M.2 SSD"','"container2"','"Windows 11 Home SL"','"1x USB Type-C (Chỉ hỗ trợ truyền dữ liệu)<br>2x USB Type-A<br>1 AC smart pin<br>1x HDMI 1.4b<br>1x Headphone/microphone combo"','"Mới"','"Normal"','70408','"Nguyên hộp, đầy đủ phụ kiện từ nhà sản xuất<br> Bảo hành pin và bộ sạc 12 tháng"','"1.46 kg"','"I5-1335U<br>16GB - 512GB <br>14.0 - FHD"','"2024-02-06 00:00:00"','"2024-01-30 00:00:00"','"GỌI THẢ GA, DATA KHỦNG"','"/t/e/text_ng_n_31__1_2.png"','"Laptop HP 14-EP0112TU 8C5L1PA"','"SMS"','"159.0000"','true','"laptop-hp-14-ep0112tu-8c5l1pa"','true','"Laptop HP 14-EP0112TU 8C5L1PA"','"159.0000"','"Giá chính thức"','"laptop-hp-14-ep0112tu-8c5l1pa"','"laptop-hp-14-ep0112tu-8c5l1pa.html"','true','"Intel Iris Xe Graphics"','"Bảo hành 12 tháng tại trung tâm bảo hành Chính hãng. 1 đổi 1 trong 30 ngày nếu có lỗi phần cứng từ nhà sản xuất. "','"159.0000"','"Realtek Wi-Fi 6 (2x2) "','null','true','null','null','null','null','null','null','null','null','null','"<div class=\\"cps-additional-note\\">\\r\\n<p>Hotsale từ ng&agrave;y <span style=\\"color: #ff0000;\\">02/02 - 05/02</span>&nbsp;: Giảm gi&aacute; chỉ c&ograve;n<span style=\\"color: #ff0000;\\">&nbsp;15,990,000<span data-sheets-value=\\"{&quot;1&quot;:2,&quot;2&quot;:&quot;19,990,000&quot;}\\" data-sheets-userformat=\\"{&quot;2&quot;:513,&quot;3&quot;:{&quot;1&quot;:0},&quot;12&quot;:0}\\"></span>đ&nbsp;</span>(số lượng c&oacute; hạn, &aacute;p dụng c&ugrave;ng ưu đ&atilde;i Smember, kh&ocirc;ng &aacute;p dụng c&ugrave;ng chương tr&igrave;nh kh&aacute;c).</p>\\r\\n<p><span>Ng&agrave;y cuối hotsale</span><span>&nbsp;chỉ &aacute;p dụng thanh to&aacute;n online 100% hoặc thanh to&aacute;n trực tiếp tại cửa h&agrave;ng.</span></p>\\r\\n</div>"','null','null','null','null','null','null','null','null','null','null','null','null','null','null','null','null','null','null','null','null','null','null','null','null','null','null','null','null','null','null','null','null','null','null','null','null','null','null','null'
'"R7-7435HS/16GB/512GB PCIE/VGA 4GB RTX2050/15.6 FHD 144HZ/WIN11/ĐEN/CHUỘT"','"/l/a/laptop_msi_2__3.png"','true','[]','"48WHrs, 3S1P, 3-cell Li-ion"','"422.0000"','"Bluetooth 5.3"','"Liên hệ CSKH"','"422.0000"','"AMD Ryzen 7 7435HS 3.1GHz (20MB Cache, up to 4.5 GHz, 8 lõi, 16 luồng)"','"35.9 x 25.6 x 2.28 ~ 2.45 cm"','"422.0000"','"1920 x 1080 pixels (FullHD)"','"15.6 inches"','"Tỷ lệ 16:9 <br> Độ sáng 250 nits <br> Độ tương phản 1000:1 <br> Độ phủ màu 45% NTSC <br> Độ phủ màu 62.5% sRGB <br> Adobe 47.34% <br> Màn hình chống chói <br> Adaptive-Sync"','null','"422.0000"','"2019-01-01 00:00:00"','"422.0000"','[]','null','null','"512GB"','86214','"/g/r/group_509_57_.png"','"Laptop Asus TUF"','"Cáp, sạc, sách hdsd"','true','"<ul><li>Trang bị chip AMD Ryzen 7 7435HS v&agrave; card đồ họa NVIDIA GeForce RTX 2050 4GB, chiến tốt c&aacute;c tựa game Esports ở mức c&agrave;i đặt đồ họa ph&ugrave; hợp.</li><li>M&agrave;n h&igrave;nh 15.6 inch Full HD (1920x1080) với tần số qu&eacute;t 144Hz, cho trải nghiệm gaming mượt m&agrave;, h&igrave;nh ảnh sắc n&eacute;t, hạn chế tối đa giật lag.</li><li>Đạt ti&ecirc;u chuẩn , chống chịu va đập, rung sốc tốt, đảm bảo hoạt động ổn định trong nhiều điều kiện.</li><li>C&ocirc;ng nghệ tản nhiệt ASUS gi&uacute;p m&aacute;y lu&ocirc;n m&aacute;t mẻ, ổn định hiệu năng trong thời gian d&agrave;i chơi game.</li><li>Sản phẩm đi k&egrave;m chuột gaming, tăng th&ecirc;m phần tiện lợi v&agrave; tiết kiệm chi ph&iacute; cho game thủ.</li></ul>"','"Không"','"720P HD camera"','"Hệ thống 2 loa <br> Công nghệ chống ồn AI <br> Phần mềm DTS <br> Chứng nhận Hi-Res"','"AMD Ryzen 7"','"RTX 2050"','"Đồ hoạ 3D, chỉnh sửa video"','"Bàn phím Chiclet có đèn nền RGB 1 vùng "','"DDR5-5600 SO-DIMM"','"Lập trình , Đồ hoạ"','"16GB"','"Full HD"','"Trên 15 inch"','"2x SO-DIMM (2x 8GB, nâng cấp tối đa 32GB)"','"Wi-Fi 6"','"Tấm nền IPS"','"144 Hz"','"NVIDIA GeForce Series"','"Chính hãng"','"no_selection"','"no_selection"','"ASUS"','"/g/r/group_509_57_.png"','"Laptop ASUS TUF Gaming A15 FA506NFR-HN075W | Giá rẻ, trả góp 0%"','"-"','"422.0000"','"4"','"2"','"Đồ họa - Kỹ thuật, Gaming"','"512GB PCIe 4.0 NVMe M.2 SSD (Nâng cấp tối đa 1TB)"','"container2"','"Windows 11 Home"','"1x RJ45 LAN <br> 1x USB 3.2 Gen 2 Type-C support DisplayPort <br> 3x USB 3.2 Gen 1 Type-A <br> 1x HDMI 2.1 TMDS <br> 1x 3.5mm Combo Audio Jack"','"Mới"','"Normal"','86214','"Nguyên hộp, đầy đủ phụ kiện từ nhà sản xuất<br> Bảo hành pin và bộ sạc 12 tháng"','"2.30 Kg "','"R7-7435HS <br>16GB - 512GB <br> RTX2050"','"2020-12-31 00:00:00"','"2020-01-01 00:00:00"','"GỌI THẢ GA, DATA KHỦNG"','"/g/r/group_509_57_.png"','"Laptop Asus TUF"','"SMS"','"422.0000"','true','"laptop-asus-tuf-gaming-a15-fa506nfr-hn075w"','true','"Laptop Asus TUF"','"422.0000"','"Giá chính thức"','"laptop-asus-tuf-gaming-a15-fa506nfr-hn075w"','"laptop-asus-tuf-gaming-a15-fa506nfr-hn075w.html"','true','"NVIDIA GeForce RTX 2050 4GB GDDR6"','"Bảo hành 24 tháng tại trung tâm bảo hành Chính hãng. 1 đổi 1 trong 30 ngày nếu có lỗi phần cứng từ nhà sản xuất. "','"422.0000"','"Wi-Fi 6(802.11ax) (Dual band) 2*2"','"Bảo vệ mật khẩu quản trị viên BIOS và mật khẩu người dùng<br> Khe bảo mật Kensington<br> Mô-đun nền tảng đáng tin cậy (Firmware TPM)"','null','null','null','null','null','null','null','null','null','null','null','null','null','null','null','null','"Không"','null','null','null','null','null','null','null','null','null','null','null','null','null','null','null','null','null','null','null','null','null','null','null','null','null','null','null','null','null','null','null','null','null'
'"I5-12500H/8GB+8GB/512GB PCIE/VGA 4GB RTX3050/15.6 FHD 144Hz/WIN11/ĐEN"','"/2/8/28_1_17.jpg"','null','[]','"4-cell, 57.5 Wh "','"7928.0000"','"5.1"','"Liên hệ CSKH"','"7928.0000"','"Intel Core i5-12500H (upto 4.5 GHz, 18MB), 12 nhân, 16 luồng"','"360.4 x 271.09 x 25.9 mm (WxDxH)"','"7928.0000"','"1920 x 1080 pixels (FullHD)"','"15.6 inches"','"Acer ComfyView LED-backlit TFT LCD"','"0.1"','"7928.0000"','"2019-01-01 00:00:00"','"7928.0000"','[]','"0.7"','"0.3"','"512GB"','42449','"/t/e/text_d_i_7_4.png"','"Laptop Gaming Acer Nitro 5 Tiger AN515 58 52SP"','"Máy, sạc, sách hướng dẫn</p><p style=\\"color: red;\\"><a href=\\"https://www.acervietnam.com.vn/bao-hanh-3s1\\"><span style=\\"color: #ff0000;\\">T&igrave;m hiểu th&ecirc;m về bảo h&agrave;nh VIP 3S1</span></a></p>"','true','"<ul><li>Chip Core i5-12500H c&ugrave;ng card rời RTX 3050 cho khả năng chiến c&aacute;c tựa game nặng, chỉnh sửa h&igrave;nh ảnh tr&ecirc;n PTS, Render video ngắn mượt m&agrave;.</li><li>Ram 8GB+8GB, ổ cứng SSD 512GB mang đến tốc độ xử l&yacute; nhanh c&ugrave;ng đa nhiệm mượt m&agrave;.</li><li>M&agrave;n h&igrave;nh 15.6 inch độ ph&acirc;n giải Full HD, mang lại chất lượng hiển thị sắc n&eacute;t.</li><li>C&ocirc;ng nghệ &acirc;m thanh DTS X:Ultra Audio, Acer Purified, Acer TrueHarmony - mang lại trải nghiệm giải tr&iacute; ch&acirc;n thật.</li><li>B&agrave;n ph&iacute;m được t&iacute;ch hợp đ&egrave;n - Thoả sức l&agrave;m việc trong m&ocirc;i trường thiếu s&aacute;ng</li></ul>"','null','"HD webcam"','"DTS® X:Ultra Audio, Acer Purified, Acer TrueHarmony "','"Intel Core i5"','null','null','"Đèn chuyển màu RGB - 4 vùng"','"DDR4 3200MHz "','null','"16GB"','"Full HD"','"Trên 15 inch"','"2 khe (Máy nguyên bản 8GB, được tặng 8GB, tối đa 32GB)"','"Wi-Fi 6"','"Tấm nền IPS"','"144Hz"','"NVIDIA GeForce Series"','"Chính hãng"','"no_selection"','"no_selection"','"Acer"','"/t/e/text_d_i_7_4.png"','"Laptop Gaming Acer Nitro 5 Tiger AN515 58 52SP | Giá rẻ"','null','"7928.0000"','"4"','"2"','"Đồ họa - Kỹ thuật, Gaming, Laptop sáng tạo nội dung"','"512GB PCIe NVMe SED SSD cắm sẵn (nâng cấp tối đa 2TB Gen4, 16 Gb/s, NVMe và 1 TB 2.5-inch 5400 RPM) "','"container2"','"Windows 11 Home"','"1x USB Type-C (Hỗ trợ: USB 3.2 Gen 2 up to 10 Gbps, DisplayPort over USB-C, Thunderbolt 4, USB charging 5 V; 3 A, DC 20 V; 65 W) <br> 2x USB 3.2 Gen 2 <br> 1x USB 3.2 Gen 1 <br> 1x Ethernet (RJ-45) <br> 1x HDMI®2.1 <br> 1x headphone/speaker jack"','"Mới"','null','42449','"Nguyên hộp, đầy đủ phụ kiện từ nhà sản xuất<br> Bảo hành pin và bộ sạc 12 tháng"','"2.5kg"','"I5-12500H<br>8GB+8GB - 512GB<br>RTX3050"','"2024-12-01 00:00:00"','"2024-11-28 00:00:00"','null','"/t/e/text_d_i_7_4.png"','"Laptop Gaming Acer Nitro 5 Tiger AN515 58 52SP"','"SMS"','"7928.0000"','true','"acer-nitro-5"','true','"Laptop Gaming Acer Nitro 5 Tiger AN515 58 52SP"','"7928.0000"','"Giá chính thức"','"laptop-gaming-acer-nitro-5-tiger-an515-58-52sp"','"laptop-gaming-acer-nitro-5-tiger-an515-58-52sp.html"','true','"NVIDIA GeForce RTX 3050 with 4GB of dedicated GDDR6 VRAM"','"Bảo hành 12 tháng tại trung tâm bảo hành Chính hãng. 1 đổi 1 trong 30 ngày nếu có lỗi phần cứng từ nhà sản xuất. "','"7928.0000"','"Wi-Fi 6 802.11 a/b/g/n+acR2"','null','true','"Vỏ nhựa"','null','null','null','null','null','null','"<div class=\\"promotion\\"><p class=\\"gift-cont\\">Tặng thêm 1 năm dịch vụ bảo hành 3S1 cho KH mua từ 1.8,2022- 31.10.2022</p></div>"','"7928.0000"','"<div class=\\"cps-additional-note\\"> <p>Flash Sales Black Fire-Day từ&nbsp;<span style=\\"color: #ff0000;\\">9h00 - 11h00 <span style=\\"color: #000000;\\">ng&agrave;y <span style=\\"color: #ff0000;\\">1.12</span></span></span></p> <p><span>Chỉ &aacute;p dụng thanh to&aacute;n online 100%, mỗi kh&aacute;ch h&agrave;ng kh&ocirc;ng mua qu&aacute; 1 sản phẩm c&ugrave;ng loại, kh&ocirc;ng &aacute;p dụng c&ugrave;ng c&aacute;c qu&agrave; tặng v&agrave; chương tr&igrave;nh giảm gi&aacute; kh&aacute;c.</span></p> </div>"','null','null','null','null','null','"Không"','null','null','null','null','null','null','null','null','null','null','null','null','null','null','null','null','null','null','null','null','null','null','null','null','null','null','null','null','null','null','null','null','null'
'"I5-13450HX/12GB/512GB PCIE/VGA 6GB RTX3050/15.6 FHD 144HZ/WIN11/XÁM"','"/t/e/text_ng_n_6__2_228.png"','true','[]','"60Wh (Đầu mỏng 170W (3 chân))"','null','"Bluetooth 5.2"','"Liên hệ CSKH"','null','"Intel Core i5-13450HX, 10 lõi (6P + 4E) / 16 luồng, P-core 2.4 / 4.6GHz, E-core 1.8 / 3.4GHz, 20MB"','"359.86 x 258.7 x 21.9-23.9 mm (Dài x Rộng x Dày)"','null','"1920 x 1080 pixels (FullHD)"','"15.6 inches"','"Độ sáng 300nits <br>Màn hình chống chói<br>Độ phủ màu 100% sRGB<br>G-SYNC"','"0.1"','null','"2019-01-01 00:00:00"','"0.0000"','[]','"0.7"','"0.3"','"512GB"','100393','"/t/e/text_d_i_6_41.png"','null','"Bộ nguồn, máy, sách hdsd"','true','"<ul><li>Trang bị vi xử l&yacute; Intel Core i5-13450HX hiệu năng cao, mang lại khả năng xử l&yacute; mạnh mẽ cho c&aacute;c t&aacute;c vụ đa nhiệm v&agrave; chơi game.</li><li>M&aacute;y sở hữu 12GB RAM v&agrave; ổ cứng SSD 512GB PCIe, đảm bảo tốc độ truy xuất dữ liệu nhanh c&ugrave;ng khả năng lưu trữ thoải m&aacute;i cho c&aacute;c ứng dụng v&agrave; t&agrave;i liệu.</li><li>Card đồ họa NVIDIA GeForce RTX 3050 6GB gi&uacute;p xử l&yacute; đồ họa mượt m&agrave;, ph&ugrave; hợp cho chơi game v&agrave; sử dụng c&aacute;c phần mềm đồ họa chuy&ecirc;n s&acirc;u.</li><li>M&agrave;n h&igrave;nh 15.6 inch Full HD với tần số qu&eacute;t 144Hz mang lại trải nghiệm hiển thị sắc n&eacute;t, chuyển động mượt m&agrave; v&agrave; chi tiết sống động.</li><li>M&aacute;y được c&agrave;i sẵn hệ điều h&agrave;nh Windows 11, c&oacute; thiết kế t&ocirc;ng x&aacute;m hiện đại, bền bỉ, ph&ugrave; hợp cho game thủ v&agrave; người d&ugrave;ng đa năng.</li></ul>"','null','"HD 720p với E-shutter"','"Âm thanh độ nét cao (HD)<br> Bộ giải mã Realtek ALC3287<br> Loa stereo, 2W x2<br> Nahimic Audio"','"Intel Core i5"','"RTX 3050"','"Đồ hoạ 3D, chỉnh sửa video"','"Đèn nền trắng"','"DDR5-4800"','"Lập trình , Đồ hoạ"','"12GB"','"Full HD"','"Trên 15 inch"','"2 khe (1x 12GB, nâng cấp tối đa 32GB DDR5-4800)"','"Wi-Fi 6"','"Tấm nền IPS"','"144Hz"','"NVIDIA GeForce Series"','"Chính hãng"','"no_selection"','"no_selection"','"Lenovo"','"/t/e/text_d_i_6_41.png"','"Laptop Lenovo LOQ 15IRX9 83DV012LVN | Giá rẻ, trả góp 0%"','"-"','null','"4"','"2"','"Đồ họa - Kỹ thuật, Gaming"','"512GB SSD M.2 2242 PCIe 4.0x4 NVMe (Tối đa hai ổ đĩa, 2x M.2 SSD, M.2 2242 SSD tối đa 1TB mỗi ổ)"','"container2"','"Windows 11 Home Single Language, English"','"3x USB-A (5Gbps / USB 3.2 Gen 1)<br> 1x USB-C (10Gbps / USB 3.2 Gen 2), với Lenovo PD 140W và DisplayPort 1.4<br> 1x HDMI 2.1, lên đến 8K/60Hz<br> 1x giắc cắm kết hợp tai nghe / micrô (3.5mm)<br> 1x Ethernet (RJ-45)<br> 1x đầu nối nguồn"','"Mới"','"Normal"','100393','"Nguyên hộp, đầy đủ phụ kiện từ nhà sản xuất<br> Bảo hành pin và bộ sạc 12 tháng"','"2.38 kg"','"I5-13450HX <br>12GB - 512GB <br> RTX3050"','"2020-12-31 00:00:00"','"2020-01-01 00:00:00"','"GỌI THẢ GA, DATA KHỦNG"','"/t/e/text_d_i_6_41.png"','null','"SMS"','null','true','null','true','null','"500000.0000"','"Giá chính thức"','"laptop-lenovo-loq-15irx9-83dv012lvn"','"laptop-lenovo-loq-15irx9-83dv012lvn.html"','true','"NVIDIA GeForce RTX 3050 6GB GDDR6, Boost Clock 1732MHz, TGP 95W, 142 AI TOPS"','"Bảo hành 24 tháng tại trung tâm bảo hành Chính hãng. 1 đổi 1 trong 30 ngày nếu có lỗi phần cứng từ nhà sản xuất. "','null','"Wi-Fi 6, 802.11ax 2x2"','"Firmware TPM 2.0 Enabled"','null','"Vỏ nhựa"','null','null','null','null','null','null','null','null','null','null','null','null','null','null','null','null','null','null','null','null','null','null','null','"Nhựa"','"Nhựa"','"Copilot"','null','null','null','null','null','null','null','null','null','null','null','null','null','null','null','null','null','null','null','null','null','null'
'"I3-1315U/16GB/512GB PCIE/14.0 FHD/WIN11/BẠC"','"/t/e/text_ng_n_20__5_42_1.png"','true','[]','"3-cell, 41 Wh Li-ion polymer <br>Bộ đổi nguồn AC thông minh 45 W"','null','"Bluetooth 5.3"','"Liên hệ CSKH"','null','"Intel Core i3-1315U (up to 4.5 GHz with Intel Turbo Boost Technology, 10 MB L3 cache, 6 lõi, 8 luồng)"','"32.37 x 21.5 x 1.79 cm (Mặt trước)<br>32.37 x 21.5 x 3.25 cm (Mặt sau)"','null','"1920 x 1080 pixels (FullHD)"','"14 inches"','"Viền siêu mỏng<br> Màn hình chống chói<br> Độ sáng 250 nits<br> Độ phủ màu 62.5% sRGB"','null','null','"2019-01-01 00:00:00"','"0.0000"','[]','null','null','"512GB"','100742','"/g/r/group_659_3__6.png"','null','"Bộ nguồn, máy, sách hdsd"','true','"<ul><li>Laptop c&oacute; kiểu d&aacute;ng thanh lịch với m&agrave;u bạc nổi bật c&ugrave;ng khung m&aacute;y chắc chắn, ph&ugrave; hợp cho cả m&ocirc;i trường văn ph&ograve;ng v&agrave; học tập.</li><li>M&agrave;n h&igrave;nh 14.0 inch FHD mang lại h&igrave;nh ảnh sắc n&eacute;t v&agrave; m&agrave;u sắc sống động, gi&uacute;p người d&ugrave;ng trải nghiệm học tập v&agrave; giải tr&iacute; tốt hơn.</li><li>Trang bị vi xử l&yacute; Intel Core i3-1315U, laptop c&oacute; khả năng xử l&yacute; mượt m&agrave; c&aacute;c t&aacute;c vụ văn ph&ograve;ng, lướt web v&agrave; xem video m&agrave; kh&ocirc;ng gặp phải t&igrave;nh trạng lag.</li><li>RAM 16GB v&agrave; ổ cứng 512GB PCIE, người d&ugrave;ng c&oacute; thể lưu trữ nhiều dữ liệu v&agrave; chạy nhiều ứng dụng c&ugrave;ng l&uacute;c m&agrave; vẫn đảm bảo hiệu suất cao.</li></ul>"','null','"Camera HP True Vision 720p HD có chức năng giảm nhiễu tạm thời và micrô kỹ thuật số mảng kép tích hợp"','"Dual speakers"','"Intel Core i3"','null','"Đồ hoạ 2D, edit hình ảnh"','"Bàn phím màu xám mềm, kích thước đầy đủ"','"DDR4-3200 MT/s"','"Xã hội - kinh tế"','"16GB"','"Full HD"','"Khoảng 14 inch"','null','null','null','null','"Card Onboard"','"Chính hãng"','"no_selection"','"no_selection"','"HP"','"/g/r/group_659_3__6.png"','"Laptop HP 14-EP0220TU B73VWPA | Giá rẻ, trả góp 0%"','"-"','null','"4"','"2"','"Học tập - Văn phòng, Mỏng nhẹ"','"512 GB PCIe NVMeTM M.2 SSD"','"container2"','"Windows 11 Home Single Language"','"1x USB Type-C 5Gbps (chỉ hỗ trợ truyền dữ liệu và không hỗ trợ sạc hoặc màn hình ngoài)<br> 2x USB Type-A 5Gbps<br> 1x Chân cắm thông minh AC<br> 1x HDMI 1.4b<br> 1x Bộ tai nghe/micrô"','"Mới"','"Normal"','100742','"Nguyên hộp, đầy đủ phụ kiện từ nhà sản xuất<br> Bảo hành pin và bộ sạc 12 tháng"','"1.4 kg"','"I3-1315U <br>16GB - 512GB<br>14.0 - FHD"','"2020-12-31 00:00:00"','"2020-01-01 00:00:00"','"GỌI THẢ GA, DATA KHỦNG"','"/g/r/group_659_3__6.png"','null','"SMS"','null','true','"hp-14"','true','null','"500000.0000"','"Giá chính thức"','"laptop-hp-14-ep0220tu-b73vwpa-16gb"','"laptop-hp-14-ep0220tu-b73vwpa-16gb.html"','true','"Intel UHD Graphics"','"Bảo hành 12 tháng tại trung tâm bảo hành Chính hãng. 1 đổi 1 trong 30 ngày nếu có lỗi phần cứng từ nhà sản xuất. "','null','"Realtek Wi-Fi 6 (2x2)"','"Mic mute key; Camera privacy shutter; Trusted Platform Module (Firmware TPM) support"','null','null','null','null','null','null','null','null','null','null','null','null','null','null','null','null','null','null','null','null','null','null','null','null','null','null','null','null','null','null','null','null','null','null','null','null','null','null','null','null','null','null','null','null','null','null','null','null','null','null'
