'"I5-12450H/16GB/512GB PCIE/15.6 FHD 144HZ/VGA 4GB RTX3050/WIN11/ĐEN"','"/t/e/text_ng_n_14__3_3_1.png"','true','[]','"3-cell Li-ion, 50 Wh"','"1568.0000"','"Bluetooth 5.1"','"Liên hệ CSKH"','"1568.0000"','"Intel Core i5 - 12450H (8 lõi / 12 luồng, 2.00 GHz, Turbo Boost 4.4 GHz, 12 MB)"','"362.3 x 237.4 x 19.9 mm (Dài x Rộng x Dày)"','"1568.0000"','"1920 x 1080 pixels (FullHD)"','"15.6 inches"','"Acer ComfyView"','null','"1568.0000"','"2019-01-01 00:00:00"','"1568.0000"','[]','null','null','"512GB"','70295','"/g/r/group_509_22_.png"','"Laptop Acer Aspire 7 A715-76G-5806"','"Máy, sạc, sách hướng dẫn</p><p style=\\"color: red;\\"><a href=\\"https://www.acervietnam.com.vn/bao-hanh-3s1\\"><span style=\\"color: #ff0000;\\">T&igrave;m hiểu th&ecirc;m về bảo h&agrave;nh VIP 3S1</span></a></p>"','true','"<ul><li>M&agrave;n h&igrave;nh 15.6 inch Full HD cho kh&ocirc;ng gian hiển thị tương đối rộng v&agrave; r&otilde; n&eacute;t, m&agrave;u sắc sống động</li><li>CPU Intel Core i5 12450H c&ugrave;ng card RTX 3050 c&acirc;n mọi t&aacute;c vụ văn ph&ograve;ng, thoả sức chiến c&aacute;c tựa game y&ecirc;u th&iacute;ch</li><li>RAM 16 GB hỗ trợ n&acirc;ng cấp tối đa 32 GB thoải m&aacute;i thao t&aacute;c với nhiều tabs Chrome m&agrave; kh&ocirc;ng lo lag, giật</li><li>Ổ cứng SSD 512 GB rộng r&atilde;i gi&uacute;p lưu trữ nhiều tệp tin, t&agrave;i liệu nhanh ch&oacute;ng</li><li>Tần số qu&eacute;t 144 Hz gi&uacute;p khung h&igrave;nh chuyển động trơn tru, hỗ trợ game thủ phản ứng nhanh ch&oacute;ng</li></ul>"','"Không"','"HD webcam"','"Acer Purified Voice <br> Acer TrueHarmony"','"Intel Core i5"','"RTX 3050"','"Đồ hoạ 3D, chỉnh sửa video"','"Đơn sắc"','"DDR4 3200 MHz"','"Lập trình "','"16GB"','"Full HD"','"Trên 15 inch"','"2 khe (1 khe 8 GB + 1 khe 8 GB, nâng cấp tối đa 32 GB)"','"Wi-Fi 6, Bảo mật vân tay"','"Tấm nền IPS"','"144 Hz"','"NVIDIA GeForce Series"','"Chính hãng"','"no_selection"','"no_selection"','"Acer"','"/g/r/group_509_22_.png"','"Laptop Acer Aspire 7 A715-76G-5806 | Giá rẻ, trả góp 0%"','"-"','"1568.0000"','"4"','"2"','"Đồ họa - Kỹ thuật, Gaming"','"512 GB SSD NVMe PCIe (Có thể tháo ra, lắp thanh khác tối đa 1 TB)"','"container2"','"Windows 11 Home SL"','"1x USB Type-C (hỗ trợ USB, DisplayPort, Thunderbolt 4) <br> 1x Jack tai nghe 3.5 mm<br> 3x USB 3.2<br> 1x HDMI<br> 1x LAN (RJ45)"','"Mới"','"Normal"','70295','"Nguyên hộp, đầy đủ phụ kiện từ nhà sản xuất<br> Bảo hành pin và bộ sạc 12 tháng"','"2.1 kg"','"I5-12450H<br>16GB - 512GB<br>RTX 3050"','"2020-12-31 00:00:00"','"2020-01-01 00:00:00"','"GỌI THẢ GA, DATA KHỦNG"','"/g/r/group_509_22_.png"','"Laptop Acer Aspire 7 A715-76G-5806"','"SMS"','"1568.0000"','true','"laptop-acer-aspire-7-a715-76g-5806"','true','"Laptop Acer Aspire 7 A715-76G-5806"','"1568.0000"','"Giá chính thức"','"laptop-acer-aspire-7-a715-76g-5806"','"laptop-acer-aspire-7-a715-76g-5806.html"','true','"NVIDIA GeForce RTX 3050, 4 GB"','"Bảo hành 12 tháng tại trung tâm bảo hành Chính hãng. 1 đổi 1 trong 30 ngày nếu có lỗi phần cứng từ nhà sản xuất. "','"1568.0000"','"Wi-Fi 6E (802.11ax)"','"Vân tay"','true','"Vỏ nhựa"','null','null','null','null','null','null','null','null','null','null','null','null','null','null','null','null','null','null','null','null','null','null','null','null','null','null','null','null','null','null','null','null','null','null','null','null','null','null','null','null','null','null','null','null','null','null','null','null'
'"U7-155H/16GB/512GB PCIE/16.0 3.2K OLED/WIN11/XANH"','"/t/e/text_ng_n_5__7_105.png"','true','[]','"75WHrs, 4S1P, 4-cell Li-ion"','"993.0000"','"Bluetooth 5.3"','"Liên hệ CSKH"','"993.0000"','"Intel Core Ultra 7 155H 1.4 GHz (24MB Cache, up to 4.8 GHz, 16 lõi, 22 luồng)"','"35.36 x 24.69 x 1.39 ~ 1.59 cm (13.92\\" x 9.72\\" x 0.55\\" ~ 0.63\\")"','"993.0000"','"3200 x 2000 pixel (WQHD+)"','"16 inches"','"Độ sáng tối đa 600nits HDR<br>Gam màu 100% DCI-P3<br>Tỷ lệ tương phản 1.000.000:1<br>Ánh sáng xanh ít gây hại hơn 70%<br>TÜV Rheinland-certified<br>1.07 tỷ màu"','null','"993.0000"','"2019-01-01 00:00:00"','"993.0000"','[]','null','null','"512GB"','82011','"/g/r/group_565_22_.png"','"Laptop Asus VivoBook S 14 OLED S5406MA-PP136W "','"Cáp<br>Sạc<br>Sách HDSD"','true','"<ul><li>Trải nghiệm h&igrave;nh ảnh sắc n&eacute;t, mượt m&agrave; v&agrave; sống động với tấm nền OLED 3.2K tần số qu&eacute;t 120Hz.</li><li>Chip AI Intel Core Ultra 7 đảm bảo hiệu năng xử l&yacute; mọi t&aacute;c vụ mượt m&agrave; &amp; nhanh ch&oacute;ng.</li><li>16GB RAM v&agrave; 512GB SSD cho khả năng xử l&yacute; đa nhiệm mượt m&agrave;, chơi game v&agrave; l&agrave;m việc đồ họa chuy&ecirc;n nghiệp.</li><li>Thiết kế mỏng nhẹ trong khung m&aacute;y ho&agrave;n to&agrave;n bằng kim loại cho t&iacute;nh di động tuyệt đối.</li></ul>"','"Không"','"Camera FHD có chức năng IR hỗ trợ Windows Hello<br> Màn trập camera"','"Smart Amp Technology, harman/kardon"','"Intel Core U7"','"AMD Radeon RX"','"Đồ hoạ 2D, edit hình ảnh"','"RGB 1 vùng"','"LPDDR5X Onboard"','"Xã hội - kinh tế"','"16GB"','"3.2K"','"Trên 15 inch"','"1 khe"','"Wi-Fi 6, Màn hình Oled"','"Tấm nền Oled"','"120Hz"','"Card Onboard"','"Chính hãng"','"no_selection"','"no_selection"','"ASUS"','"/g/r/group_565_22_.png"','"Laptop ASUS VivoBook S 16 OLED S5606MA-MX051W | Giá rẻ, trả góp 0%"','"-"','"993.0000"','"4"','"2"','"Học tập - Văn phòng"','"512GB M.2 NVMe PCIe 4.0 SSD"','"container2"','"Windows 11 Home"','"2x USB 3.2 Gen 1 Type-A<br>2x Thunderbolt™ 4 supports display / power delivery<br>1x HDMI 2.1 TMDS<br>1x 3.5mm Combo Audio Jack<br>Đầu đọc thẻ Micro SD"','"Mới"','"Normal"','82011','"Mới, đầy đủ phụ kiện từ nhà sản xuất"','"1.50 kg"','"U7-155H <br>16GB - 512GB<br>16.0 - 3.2K"','"2020-12-31 00:00:00"','"2020-01-01 00:00:00"','"GỌI THẢ GA, DATA KHỦNG"','"/g/r/group_565_22_.png"','"Laptop Asus VivoBook S 14 OLED S5406MA-PP136W "','"SMS"','"993.0000"','true','"laptop-asus-vivobook-s-16-oled-s5606ma-mx051w"','true','"Laptop Asus VivoBook S 14 OLED S5406MA-PP136W "','"993.0000"','"Giá chính thức"','"laptop-asus-vivobook-s-16-oled-s5606ma-mx051w"','"laptop-asus-vivobook-s-16-oled-s5606ma-mx051w.html"','true','"Intel Arc Graphics"','"Bảo hành 24 tháng tại trung tâm bảo hành Chính hãng. 1 đổi 1 trong 30 ngày nếu có lỗi phần cứng từ nhà sản xuất. "','"993.0000"','"Wi-Fi 6E(802.11ax) (Dual band) 2*2"','"McAfee 30 ngày dùng thử miễn phí <br> Webcam IR với Windows Hello<br> McAfee<br> BIOS thiết lập mật khẩu người dùng <br> Mô-đun nền tảng đáng tin cậy (Firmware TPM)"','null','"Vỏ kim loại"','null','null','null','null','null','null','null','"993.0000"','null','null','null','null','null','null','"Có"','null','null','null','null','null','null','null','null','"Nhôm"','"Nhôm"','"Copilot"','null','"Nhôm"','null','"Copilot"','null','null','null','null','null','null','null','null','null','null','null','null','null','null','null','null','null','null'
'"I5-1155G7/8GB/256GB PCIE/15.6 FHD/CẢM ỨNG/WIN11/ĐEN NHẬP KHẨU CHÍNH HÃNG"','"/t/e/text_ng_n_6_39.png"','true','[]','"lithium-polymer"','"3394.0000"','"Bluetooth 5.1"','"Liên hệ CSKH"','"3394.0000"','"Intel Core i5-1155G7 (15 W, 4 lõi / 8 luồng, 2.50 GHz to 4.50 GHz, 8 MB)"','"16.96 - 18.99 x 358.50 x 235.56 mm (H x W x D)"','"3394.0000"','"1920 x 1080 pixels (FullHD)"','"15.6 inches"','"Độ sáng 250 nits<br> Độ phủ màu NTSC 45%<br> Màn hình chống chói"','"0.1"','"3394.0000"','"2019-01-01 00:00:00"','"3394.0000"','[]','"0.7"','"0.3"','"256GB"','75064','"/t/e/text_ng_n_2__4_28.png"','"Laptop Dell Inspiron 15 3520-5810BLK 102F0"','"Sạc, sách hướng dẫn sử dụng<br><p style=\\"color: red;\\"><a href=\\"https://cellphones.com.vn/sforum/tim-hieu-chi-tiet-ve-laptop-nhap-khau-uu-diem-che-do-bao-hanh-chat-luong-ra-sao\\"><span style=\\"color: #ff0000;\\">T&igrave;m hiểu th&ecirc;m về laptop nhập khẩu"','true','"<ul><li>Thiết kế đơn giản, trẻ trung với tone m&agrave;u đen bao phủ.</li><li>M&agrave;n h&igrave;nh cảm ứng 15.6 inch Full HD cho trải nghiệm h&igrave;nh ảnh v&ocirc; c&ugrave;ng sắc n&eacute;t.</li><li>CPU Intel core i5-1155G7 c&ugrave;ng 8 GB RAM DDR4 xử l&yacute; mượt c&aacute;c t&aacute;c vụ văn ph&ograve;ng: Word, Excel,...</li><li>Card đồ họa&nbsp;Intel Iris Xe&nbsp;Graphics&nbsp;hỗ trợ chỉnh ảnh đơn giản.</li><li>Kh&ocirc;ng gian lưu trữ vừa phải với ổ cứng 256 GB SSD.</li></ul>"','"Có"','"HD camera "','"Âm thanh độ nét cao, 2 W - 2.5 W"','"Intel Core i5"','null','null','null','"DDR4 2666 MHz"','"Xã hội - kinh tế"','"8GB"','"Full HD"','"Trên 15 inch"','"2 khe SODIMM (nâng cấp tối đa 16GB)"','""','"Tấm nền IPS"','"60 Hz "','"Card Onboard"','"Chính hãng"','"no_selection"','"no_selection"','"Dell"','"/t/e/text_ng_n_2__4_28.png"','"Laptop Dell Inspiron 15 3520-5810BLK 102F0 | Giá rẻ, trả góp 0%"','"-"','"3394.0000"','"4"','"2"','"Học tập - Văn phòng"','"256 GB "','"container2"','"Windows 11"','"1x Đầu nối nguồn <br> 1x HDMI 1.4 <br> 2x USB 3.2 Gen 1<br> 1x Khe cắm thẻ SD<br> 1x USB 2.0<br> 1x Cổng tai nghe"','"Mới"','"Normal"','75064','"Nguyên hộp, đầy đủ phụ kiện từ nhà sản xuất<br> Bảo hành pin và bộ sạc 12 tháng"','"1.90 kg"','"I5-1155G7 <br>8GB - 256GB"','"2020-12-31 00:00:00"','"2020-01-01 00:00:00"','"GỌI THẢ GA, DATA KHỦNG"','"/t/e/text_ng_n_2__4_28.png"','"Laptop Dell Inspiron 15 3520-5810BLK 102F0"','"SMS"','"3394.0000"','true','"laptop-dell-inspiron-15-3520-5810blk-102f0"','true','"Laptop Dell Inspiron 15 3520-5810BLK 102F0"','"3394.0000"','"Giá chính thức"','"laptop-dell-inspiron-15-3520-5810blk-102f0"','"laptop-dell-inspiron-15-3520-5810blk-102f0.html"','true','"Intel Iris Xe Graphics"','"Bảo hành 1 đổi 1 trong vòng 12 tháng bởi Nhà Phân Phối (Áp dụng máy bán từ 1.7.2022) Các máy mua trước đó áp dụng bảo hành 12 tháng tại các trung tâm Bảo hành FPT Service trên toàn quốc"','"3394.0000"','"WiFi 802.11a/b/g"','null','null','"Vỏ nhựa"','null','null','null','null','null','null','null','null','null','null','null','null','null','null','"Có"','null','null','null','null','null','null','null','null','null','null','null','null','null','null','null','null','null','null','null','null','null','null','null','null','null','null','null','null','null','null','null','null','null'
'"I5-12450H/16GB/512GB PCIE/15.6 FHD/WIN11/ĐEN"','"/t/e/text_ng_n_6_18.png"','true','[]','"3-cell, 50Wh"','"4119.0000"','"Bluetooth 5.1"','"Liên hệ CSKH"','"4119.0000"','"Intel Core i5-12450H (8 lõi / 12 luồng, 4.4GHz, 12MB)"','"362.3 x 237.4 x 19.9 mm"','"4119.0000"','"1920 x 1080 pixels (FullHD)"','"15.6 inches"','"Acer ComfyView"','null','"4119.0000"','"2019-01-01 00:00:00"','"4119.0000"','[]','null','null','"512GB"','71865','"/g/r/group_509_11__1.png"','"Laptop Acer Gaming Aspire 7 A715-76-53PJ"','"Máy, sạc, sách hướng dẫn</p><p style=\\"color: red;\\"><a href=\\"https://www.acervietnam.com.vn/bao-hanh-3s1\\"><span style=\\"color: #ff0000;\\">T&igrave;m hiểu th&ecirc;m về bảo h&agrave;nh VIP 3S1</span></a></p>"','true','"<ul><li>CPU Intel Core i5-12450H dễ d&agrave;ng xử l&yacute; mọi t&aacute;c vụ l&agrave;m việc học tập, l&agrave;m việc thường ng&agrave;y.</li><li>RAM 16GB DDR4 c&ugrave;ng ổ cứng dung lượng 512GB PCIe NVMe SSD c&oacute; tốc độ đọc ghi si&ecirc;u cao, thời gian mở m&aacute;y, truy cập tệp, copy tệp,... nhanh ch&oacute;ng.</li><li>M&agrave;n h&igrave;nh 15.6 inch Full HD cho kh&ocirc;ng gian trải nghiệm nội dung tương đối rộng r&atilde;i, m&agrave;u sắc r&otilde; n&eacute;t.</li><li>C&ocirc;ng nghệ Acer ComfyView bảo vệ đ&ocirc;i mắt của bạn khỏi những t&aacute;c động ti&ecirc;u cực từ &aacute;nh s&aacute;ng m&agrave;n h&igrave;nh.</li></ul>"','"Không"','"HD Webcam (720p Webcam)"','null','"Intel Core i5"','null','null','"LED"','"DDR4 3200Mhz "','"Lập trình , Xã hội - kinh tế"','"16GB"','"Full HD"','"Trên 15 inch"','"2 khe (2x 8GB, hỗ trợ nâng cấp tối đa 32GB)"','"Wi-Fi 6, Bảo mật vân tay"','"Tấm nền IPS"','"60 Hz"','"Card Onboard"','"Chính hãng"','"no_selection"','"no_selection"','"Acer"','"/g/r/group_509_11__1.png"','"Laptop Acer Gaming Aspire 7 A715-76-53PJ | Giá rẻ, trả góp 0%"','"-"','"4119.0000"','"4"','"2"','"Học tập - Văn phòng"','"512GB PCIe NVMe SSD (Nâng cấp tối đa 1 TB SSD PCIe Gen4, 16 Gb/s, NVMe)"','"container2"','"Windows 11 Home"','"1x Ethernet (RJ-45)<br>1x USB Type C<br>3x USB-A<br>1x HDMI 2.0<br>1x DC-in jack<br>1x Jack 3.5 mm"','"Mới"','"Normal"','71865','"Nguyên hộp, đầy đủ phụ kiện từ nhà sản xuất<br> Bảo hành pin và bộ sạc 12 tháng"','"2.1 kg"','"I5-12450H<br>16GB - 512GB<br> INTEL UHD"','"2020-12-31 00:00:00"','"2020-01-01 00:00:00"','"GỌI THẢ GA, DATA KHỦNG"','"/g/r/group_509_11__1.png"','"Laptop Acer Gaming Aspire 7 A715-76-53PJ"','"SMS"','"4119.0000"','true','"laptop-acer-gaming-aspire-7-a715-76-53pj"','true','"Laptop Acer Gaming Aspire 7 A715-76-53PJ"','"4119.0000"','"Giá chính thức"','"laptop-acer-gaming-aspire-7-a715-76-53pj"','"laptop-acer-gaming-aspire-7-a715-76-53pj.html"','true','"Intel UHD Graphics"','"Bảo hành 12 tháng tại trung tâm bảo hành Chính hãng. 1 đổi 1 trong 30 ngày nếu có lỗi phần cứng từ nhà sản xuất. "','"4119.0000"','"Wifi 6E"','"Mở khóa vân tay"','true','null','null','null','null','null','null','null','null','null','null','null','null','null','null','null','null','null','null','null','null','null','null','null','null','null','null','null','null','null','null','null','null','null','null','null','null','null','null','null','null','null','null','null','null','null','null','null','null','null'
'"I5-1235U/8GB/512GB PCIE/15.6 FHD/WIN11/ĐEN"','"/t/e/text_ng_n_6__2_87.png"','true','[]','"3-cell, 41 Wh lithium-polymer"','"1672.0000"','"Bluetooth 5.0"','"Liên hệ CSKH"','"1672.0000"','"Intel Core i5-1235U (10 lõi / 12 luồng, 1.30 GHz to 4.40 GHz, 12 MB)"','"16.96 x 358.50 x 235.56 mm (C x R x S)"','"1672.0000"','"1920 x 1080 pixels (FullHD)"','"15.6 inches"','"Độ sáng 250 nits <br>Độ phủ màu NTSC 45%<br>Màn hình chống chói"','"0.1"','"1672.0000"','"2019-01-01 00:00:00"','"1672.0000"','[]','"0.7"','"0.3"','"512GB"','86709','"/t/e/text_ng_n_7__2_79.png"','null','"Cáp, sạc, sách hdsd<br><p style=\\"color: red;\\"><a href=\\"https://cellphones.com.vn/sforum/tim-hieu-chi-tiet-ve-laptop-nhap-khau-uu-diem-che-do-bao-hanh-chat-luong-ra-sao\\"><span style=\\"color: #ff0000;\\">T&igrave;m hiểu th&ecirc;m về laptop nhập khẩu"','true','"<ul><li>Trang bị bộ vi xử l&yacute; Intel Core i5-1235U, mang lại hiệu suất đ&aacute;ng tin cậy cho c&aacute;c t&aacute;c vụ h&agrave;ng ng&agrave;y.</li><li>Với 8GB RAM v&agrave; ổ cứng 512GB, m&aacute;y đ&aacute;p ứng tốt nhu cầu lưu trữ v&agrave; đa nhiệm của người d&ugrave;ng.</li><li>M&agrave;n h&igrave;nh 15.6 inch FHD mang đến trải nghiệm xem đa phương tiện sống động.</li><li>Thiết kế vỏ nhựa m&agrave;u đen tối giản, tạo cảm gi&aacute;c sang trọng v&agrave; tinh tế.</li></ul>"','"Không"','"HD camera"','"Realtek ALC3204/Realtek ALC3254"','"Intel Core i5"','null','"Đồ hoạ 2D, edit hình ảnh"','null','"DDR4"','"Xã hội - kinh tế"','"8GB"','"Full HD"','"Trên 15 inch"','"2 khe (tối đa 16GB)"','"Wi-Fi 6"','"Tấm nền IPS"','"120 Hz"','"Card Onboard"','"Chính hãng"','"no_selection"','"no_selection"','"Dell"','"/t/e/text_ng_n_7__2_79.png"','"Laptop Dell Inspiron 15 3520 6R6NK | Giá rẻ, trả góp 0%"','"-"','"1672.0000"','"4"','"2"','"Học tập - Văn phòng"','"512GB PCIE (1 Slot HDD Tối đa 1TB)"','"container2"','"Windows 11 Home"','"1x Đầu nối nguồn<br> 1x HDMI 1.4<br> 2x USB 3.2 Gen 1<br> 1x Khe cắm thẻ SD<br> 1x USB 2.0<br> 1x Cổng tai nghe"','"Mới"','"Normal"','86709','"Nguyên hộp, đầy đủ phụ kiện từ nhà sản xuất<br> Bảo hành pin và bộ sạc 12 tháng"','"1.66 kg"','"I5-1235U <br>8GB - 512GB"','"2020-12-31 00:00:00"','"2020-01-01 00:00:00"','"GỌI THẢ GA, DATA KHỦNG"','"/t/e/text_ng_n_7__2_79.png"','null','"SMS"','"1672.0000"','true','"laptop-dell-inspiron-15-3520-6r6nk"','true','null','"1672.0000"','"Giá chính thức"','"laptop-dell-inspiron-15-3520-6r6nk"','"laptop-dell-inspiron-15-3520-6r6nk.html"','true','"Intel UHD Graphics"','"Bảo hành 1 đổi 1 trong vòng 12 tháng bởi Nhà Phân Phối (Áp dụng máy bán từ 1.7.2022) Các máy mua trước đó áp dụng bảo hành 12 tháng tại các trung tâm Bảo hành FPT Service trên toàn quốc"','"1672.0000"','"Wi-Fi 6 (Card 8821CE-VC)"','null','null','"Vỏ nhựa"','null','null','null','null','null','null','null','null','null','null','null','null','null','null','"Có"','null','null','null','null','null','null','null','null','null','null','null','null','null','null','null','null','null','null','null','null','null','null','null','null','null','null','null','null','null','null','null','null','null'
'"I5-13420H/16GB/512GB PCIE/14.0 WUXGA/WIN11/XÁM"','"/t/e/text_ng_n_6__2_225.png"','true','[]','"60Wh (Đầu tròn 65W (3 chân)"','null','"Bluetooth 5.2"','"Liên hệ CSKH"','null','"Intel Core i5-13420H, 8 lõi (4P + 4E) / 12 luồng, P-core 2.1 / 4.6GHz, E-core 1.5 / 3.4GHz, 12MB"','"314.4 x 222.1 x 16.9-17.9 mm (Dài x Rộng x Dày)"','null','"1920 x 1200 pixels (WUXGA)"','"14 inches"','"Độ sáng 300nits <br>Màn hình chống chói<br>Độ phủ màu 45% NTSC"','"0.1"','null','"2019-01-01 00:00:00"','"0.0000"','[]','"0.7"','"0.3"','"512GB"','100339','"/g/r/group_659_1__8.png"','null','"Bộ nguồn, máy, sách hdsd"','true','"<ul><li>Được trang bị chip Intel Core i5-13420H, laptop cung cấp hiệu suất vượt trội, đ&aacute;p ứng tốt c&aacute;c t&aacute;c vụ đa nhiệm v&agrave; xử l&yacute; đồ họa cơ bản.</li><li>M&aacute;y c&oacute; RAM 16GB gi&uacute;p người d&ugrave;ng thực hiện nhiều ứng dụng một l&uacute;c m&agrave; kh&ocirc;ng bị lag, c&ugrave;ng ổ SSD 512GB PCIE cho tốc độ truy xuất dữ liệu nhanh ch&oacute;ng.</li><li>Với m&agrave;n h&igrave;nh 14.0 inch WUXGA, laptop mang lại h&igrave;nh ảnh sắc n&eacute;t v&agrave; m&agrave;u sắc sống động, ph&ugrave; hợp cho việc xem phim v&agrave; thiết kế đồ họa.</li><li>Laptop chạy tr&ecirc;n Windows 11, cung cấp c&aacute;c t&iacute;nh năng mới v&agrave; trải nghiệm người d&ugrave;ng mượt m&agrave;.</li></ul>"','null','"HD 720p với màn trập camera"','"High Definition (HD) Audio<br>Loa stereo, 2W x2 <br> Dolby Audio"','"Intel Core i5"','null','"Đồ hoạ 2D, edit hình ảnh"','"Không có đèn nền"','"DDR5-4800"','"Xã hội - kinh tế"','"16GB"','"WUXGA"','"Khoảng 14 inch"','"2 khe (8GB Onboard + 8GB DDR5-4800, nâng cấp tối đa 24GB (8GB Onboard + 16GB SO-DIMM))"','"Wi-Fi 6"','"Tấm nền IPS"','null','"Card Onboard"','"Chính hãng"','"no_selection"','"no_selection"','"Lenovo"','"/g/r/group_659_1__8.png"','"Laptop Lenovo IdeaPad Slim 3 14IRH10 83K00008VN | Giá rẻ, trả góp 0%"','"-"','null','"4"','"2"','"Học tập - Văn phòng, Mỏng nhẹ"','"512GB SSD M.2 2242 PCIe 4.0x4 NVMe (Tối đa hai ổ đĩa, nâng cấp lên đến 1TB)"','"container2"','"Windows 11 Home Single Language, English"','"2x USB-A (USB 5Gbps / USB 3.2 Gen 1)<br> 1x USB-C (USB 5Gbps / USB 3.2 Gen 1), với USB PD 3.0 và DisplayPort 1.2<br> 1x HDMI 1.4<br> 1x giắc cắm kết hợp tai nghe / micrô (3,5 mm)<br> 1x đầu đọc thẻ SD<br> 1x đầu nối nguồn"','"Mới"','"Normal"','100339','"Nguyên hộp, đầy đủ phụ kiện từ nhà sản xuất<br> Bảo hành pin và bộ sạc 12 tháng"','"1.43 kg"','"I5-13420H <br>16GB - 512GB<br>14.0 - WUXGA"','"2020-12-31 00:00:00"','"2020-01-01 00:00:00"','"GỌI THẢ GA, DATA KHỦNG"','"/g/r/group_659_1__8.png"','null','"SMS"','null','true','null','true','null','"500000.0000"','"Giá chính thức"','"laptop-lenovo-ideapad-slim-3-14irh10-83k00008vn"','"laptop-lenovo-ideapad-slim-3-14irh10-83k00008vn.html"','true','"Intel UHD Graphics"','"Bảo hành 24 tháng tại trung tâm bảo hành Chính hãng. 1 đổi 1 trong 30 ngày nếu có lỗi phần cứng từ nhà sản xuất. "','null','"Wi-Fi 6, 802.11ax 2x2"','"Firmware TPM 2.0 Enabled"','null','null','null','null','null','null','null','null','null','null','null','null','null','null','null','null','"Có"','null','null','null','null','null','null','null','null','"Nhựa"','"Nhôm"','null','null','"Nhôm"','null','null','null','null','null','null','null','null','null','null','null','null','null','null','null','null','null','null','null','null'
'"I7-13620H/16GB/512GB PCIE/VGA 4GB RTX2050/15.6 FHD 144HZ/WIN11/ĐEN"','"/l/a/laptop-gaming-acer-nitro-v-anv15-51-72vs_4_.jpg"','true','[]','"4 cell, 57Wh"','"269.0000"','"Bluetooth 5"','"Liên hệ CSKH"','"269.0000"','"Intel Core i7-13620H (10 lõi / 16 luồng, upto 4.90 GHz, 24 MB)"','"362.3 x 239.89 x 22.9/26.9 mm (W x D x H)"','"269.0000"','"1920 x 1080 pixels (FullHD)"','"15.6 inches"','"Acer ComfyView LED-backlit TFT LCD"','null','"269.0000"','"2019-01-01 00:00:00"','"269.0000"','[]','null','null','"512GB"','76006','"/g/r/group_509_49_.png"','"Laptop Gaming Acer Nitro V ANV15-51-72VS NH.QNASV.004"','"Dây nguồn, Sách hướng dẫn, Sạc Laptop</p><p style=\\"color: red;\\"><a href=\\"https://www.acervietnam.com.vn/bao-hanh-3s1\\"><span style=\\"color: #ff0000;\\">T&igrave;m hiểu th&ecirc;m về bảo h&agrave;nh VIP 3S1</span></a></p>"','true','"<ul><li>Trang bị CPU Intel Core i7-13620H xử l&yacute; nhanh ch&oacute;ng mọi t&aacute;c vụ văn ph&ograve;ng hay&nbsp;tận hưởng c&aacute;c tựa game từ AAA đến game Esport.</li><li>Bộ nhớ RAM 16 GB DDR5 cho khả năng xử l&yacute; đa nhiệm v&agrave; đa t&aacute;c vụ của m&aacute;y c&agrave;ng được tăng tốc tối đa.</li><li>Card đồ họa&nbsp;RTX 2050 tối ưu hiệu suất v&agrave; năng lượng,&nbsp;chiến mượt c&aacute;c tựa game AAA với mức đồ họa từ Low/Basic trở l&ecirc;n.</li><li>Tận hưởng c&aacute;c cuộc phi&ecirc;u lưu, giải tr&iacute; sống động tr&ecirc;n m&agrave;n h&igrave;nh 15.6 inch FHD, c&ugrave;ng tần số qu&eacute;t chuẩn chiến game 144 Hz.</li></ul>"','"Không"','"720P HD"','null','"Intel Core i7"','"RTX 2050"','"Đồ hoạ 3D, chỉnh sửa video"','null','"DDR5 5200 MHz"','"Lập trình , Đồ hoạ"','"16GB"','"Full HD"','"Trên 15 inch"','"2 khe (8 GB + 8 GB), Hỗ trợ nâng cấp tối đa 32GB"','"Wi-Fi 6"','"Tấm nền IPS"','"144 Hz"','"NVIDIA GeForce Series"','"Chính hãng"','"no_selection"','"no_selection"','"Acer"','"/g/r/group_509_49_.png"','"Laptop Gaming Acer Nitro V ANV15-51-72VS NH.QNASV.004 | Giá rẻ, trả góp 0%"','"-"','"269.0000"','"4"','"2"','"Gaming"','"512GB PCIe NVMe SSD (nâng cấp tối đa 2TB)"','"container2"','"Windows 11 Home"','"1 x USB Type-C™<br>3 x USB-A<br>1 x HDMI® 2.1 port with HDCP support<br>1 x 3.5 mm headphone/speaker jack<br>1 x Ethernet (RJ-45) port<br>1 x DC-in jack for AC adapter"','"Mới"','"Normal"','76006','"Nguyên hộp, đầy đủ phụ kiện từ nhà sản xuất"','"2.1 kg"','"I7-13620H<br>16GB - 512GB<br>RTX 2050"','"2020-12-31 00:00:00"','"2020-01-01 00:00:00"','"GỌI THẢ GA, DATA KHỦNG"','"/g/r/group_509_49_.png"','"Laptop Gaming Acer Nitro V ANV15-51-72VS NH.QNASV.004"','"SMS"','"269.0000"','true','"laptop-gaming-acer-nitro-v-anv15-51-72vs"','true','"Laptop Gaming Acer Nitro V ANV15-51-72VS NH.QNASV.004"','"269.0000"','"Giá chính thức"','"laptop-gaming-acer-nitro-v-anv15-51-72vs"','"laptop-gaming-acer-nitro-v-anv15-51-72vs.html"','true','"NVIDIA GeForce RTX 2050 4GB GDDR6 VRAM"','"Bảo hành 24 tháng tại trung tâm bảo hành Chính hãng. 1 đổi 1 trong 30 ngày nếu có lỗi phần cứng từ nhà sản xuất. "','"269.0000"','"Intel Wi-Fi 6 AX201(2*2 ax)"','"Giải pháp vân tay Acer Bio-Protection<br>Giải pháp Mô-đun Nền Tảng Tin Cậy (TPM) Firmware<br>Mật khẩu người dùng<br>Quản trị viên BIOS<br>Khe khóa Kensington"','null','"Vỏ nhựa"','null','null','null','null','null','null','null','null','null','null','null','null','null','null','null','null','null','null','null','null','null','null','null','null','null','null','null','null','null','null','null','null','null','null','null','null','null','null','null','null','null','null','null','null','null','null','null','null'
